{"reviewer":"codex","schemaVersion":1,"scores":null,"weightedTotal":null,"verdict":"FAIL","issues":[{"severity":"P1","location":"server/handlers/room.ts:85","description":"`join:space`가 kick 쿨다운을 async DB 조회 전에만 검사합니다. 새 탭/구버전 번들/재생성 소켓이 kick과 동시에 join을 시작하면, line 85의 검사를 통과한 뒤 DB await 중 `applyEnforcement`가 `markUserKicked`를 호출합니다. 이 소켓은 아직 room에 없어서 `socketsForUser`에도 잡히지 않고, 이후 handler가 재개되면 line 155 `socket.join(spaceId)`까지 도달해 쿨다운 중 복귀할 수 있습니다. 서버 게이트가 최종 방어라는 핵심 안전 속성의 TOCTOU 구멍입니다.","recommendation":"DB 조회와 `isSpaceArchived` 재확인 이후, `socket.join`/presence 등록 직전에 `isUserKicked(spaceId, userId)`를 한 번 더 검사하고 KICKED를 emit 후 return하세요. paused Prisma promise 중간에 `markUserKicked`를 호출하는 서버-side race 테스트도 추가하세요.","defer":false,"deferRationale":null,"fixNow":true},{"severity":"P3","location":"src/lib/kick-cooldown.ts:37","description":"놓쳤을 수 있는 결함: 만료 항목은 같은 key가 다시 조회될 때만 삭제됩니다. 강퇴된 사용자가 재입장을 시도하지 않으면 entry가 프로세스 lifetime 동안 남아, 장기 실행 서버에서는 kick된 (space,user) 수만큼 Map이 계속 증가할 수 있습니다.","recommendation":"낮은 빈도라면 후속으로 처리해도 되지만, `mark` 시 opportunistic sweep 또는 `setTimeout` 기반 clear(until 일치 확인으로 재-kick 연장 보존)를 추가하면 TTL 의미와 메모리 사용이 일치합니다.","defer":true,"deferRationale":"30초 임시 kick의 저빈도 운영에서는 즉시 안전성 문제는 아니지만 장기 실행/고빈도 운영에서 누적될 수 있습니다.","fixNow":false},{"severity":"P3","location":"verification","description":"`npx tsc --noEmit --pretty false`와 쓰기 없는 socket esbuild 번들은 통과했습니다. 대상 vitest 실행은 Vite config 로딩 중 esbuild child process `spawn EPERM`으로 시작하지 못했습니다.","recommendation":"병합 전 일반 개발/CI 환경에서 `npx vitest run src/lib/kick-cooldown.test.ts src/features/space/socket/internal/kick-guard.test.ts src/features/space/socket/internal/use-socket.test.ts`를 재실행하세요.","defer":true,"deferRationale":"현재 read-only/managed sandbox의 실행 제한으로 보이며 코드 판정의 주된 근거는 아닙니다.","fixNow":false}]}