{"reviewer":"codex","schemaVersion":1,"scores":null,"weightedTotal":null,"verdict":"FAIL","issues":[{"severity":"P1","location":"src/features/space/livekit-moderation/internal/eviction.test.ts:33","description":"Canonical typecheck fails: `npx tsc --noEmit --incremental false --pretty false` reports TS2540 because the new test assigns to read-only `process.env.NODE_ENV` at lines 33, 40, 58, and 69.","recommendation":"Replace direct `process.env.NODE_ENV = ...` restoration/mutation with Vitest env helpers such as `vi.stubEnv(\"NODE_ENV\", \"production\")` plus `vi.unstubAllEnvs()`, or mutate through a typed helper that does not violate the readonly `NODE_ENV` declaration.","defer":false,"deferRationale":null,"fixNow":true},{"severity":"P1","location":"src/app/api/livekit/token/route.ts:161","description":"Ban is not permanent for LiveKit token issuance: the token route checks only that a `SpaceMember` row exists (`select: { id: true }`) and then issues `serverParticipantId = user-${session.user.id}`. A BANNED user can request a fresh LiveKit token directly or from stale client state after WI-045 removes them, rejoining video without socket presence.","recommendation":"Select `restriction` in the token route and reject `restriction === \"BANNED\"` before issuing a user LiveKit token. Add a regression test covering BANNED user token denial.","defer":false,"deferRationale":null,"fixNow":true}]}