{"reviewer":"codex","schemaVersion":1,"scores":null,"weightedTotal":null,"verdict":"FAIL","issues":[{"severity":"P2","location":"scripts/backfill-stored-asset-metadata.core.mjs:57","description":"Production gate still has a real bypass: PostgreSQL/Prisma accepts `host` as a connection URI query parameter. `isRemoteDatabase(\"postgresql://u:p@localhost:5432/app?host=prod.invalid&connect_timeout=1\")` returns `false`, so `scripts/backfill-stored-asset-metadata.mjs --apply` does not abort. Script-level PoC then reached `prisma.generatedAsset.findMany()` and Prisma reported it was trying `prod.invalid:5432`, confirming the query parameter can change the actual target while the gate sees only `localhost`. The r2 `?schema=localhost` bypass is fixed, and the direct-import drift guard is materially fixed, but this remaining host-query vector keeps the prod gate incomplete.","recommendation":"Make `isRemoteDatabase` validate the effective PostgreSQL target, not only `new URL().hostname`: inspect `searchParams.get(\"host\")` and likely `hostaddr`/multi-host forms, and classify any non-exact local target as remote. Add regression cases for `postgresql://...@localhost/...?...host=prod.invalid` and `hostaddr=<non-loopback>` that must return `true` and abort before Prisma queries.","defer":false,"deferRationale":null,"fixNow":true}]}