{"reviewer":"codex","schemaVersion":1,"scores":null,"weightedTotal":null,"verdict":"WARNING","issues":[{"severity":"P3","location":"src/lib/kick-cooldown.test.ts:73","description":"The production sweep logic is correct, but the new test named \"sweep은 아직 유효한 다른 키를 지우지 않는다\" does not actually exercise a sweep. It marks `a` and `b`, then checks `b` at `20_001`, before `a` has expired and without any subsequent `mark(...)` call to trigger the opportunistic sweep. This leaves the intended regression case untested: expired key removed while a different live key survives the sweep.","recommendation":"Change this test to call a new `mark(\"c\", 40_000)` after `a` expires but before `b` expires, then assert `a` is inactive/removed and `b` remains active. The r1 P1 TOCTOU itself is resolved: `isUserKicked` is rechecked after all awaits and immediately before `socket.join`, and `markUserKicked` runs synchronously before socket enumeration.","defer":false,"deferRationale":null,"fixNow":false}]}