{"reviewer":"codex","schemaVersion":1,"scores":null,"weightedTotal":null,"verdict":"WARNING","issues":[{"severity":"P3","location":"validation: vitest run src/components/space/member-actions-menu.test.tsx","description":"구현 검토상 WI-039 결함은 발견하지 못했지만, Vitest 재실행은 현재 read-only/제한 샌드박스에서 Vite/esbuild child process spawn이 EPERM으로 막혀 완료하지 못했다. `npm exec tsc -- --noEmit`와 `npm run lint`는 통과했으며 lint는 기존 LiveKit warning 1건만 보고했다.","recommendation":"쓰기/프로세스 생성이 허용되는 일반 개발 환경에서 `npm exec vitest -- run src/components/space/member-actions-menu.test.tsx` 또는 전체 `npm test`를 재실행해 기계 게이트를 확인한다.","defer":true,"deferRationale":"현재 검증 환경의 프로세스 생성 제한으로 인한 실행 불가이며 구현 결함이 아니다.","fixNow":false}]}