{"reviewer":"codex","schemaVersion":1,"scores":null,"weightedTotal":null,"verdict":"FAIL","issues":[{"severity":"P2","location":"scripts/backfill-stored-asset-metadata.core.mjs:80","description":"r4의 host/hostaddr override 차단이 아직 완전하지 않습니다. `url.searchParams.get(key)`는 첫 번째 값만 검사하므로 `postgresql://u:p@localhost:5432/app?host=localhost&host=prod.invalid` 및 `?hostaddr=127.0.0.1&hostaddr=8.8.8.8`가 `isRemoteDatabase`에서 false로 판정됩니다. 실측: direct core import에서 두 케이스 모두 false. PostgreSQL libpq 문서는 반복 키워드에서 마지막 non-empty 값이 사용된다고 설명하고, 소스의 `conninfo_storeval`은 기존 option 값을 free 후 새 값으로 교체합니다: https://www.postgresql.org/docs/current/libpq-connect.html, https://doxygen.postgresql.org/fe-connect_8c_source.html#l07449","recommendation":"`url.searchParams.getAll(key)`로 모든 반복 `host`/`hostaddr` 값을 수집한 뒤 각 값을 콤마 split 하십시오. 최소 회귀 테스트로 `host=localhost&host=prod.invalid`와 `hostaddr=127.0.0.1&hostaddr=8.8.8.8`를 추가해야 합니다.","defer":false,"deferRationale":null,"fixNow":true},{"severity":"P3","location":"scripts/backfill-stored-asset-metadata.core.mjs:80","description":"과다 활성 측면: `?host=%2Fvar%2Frun%2Fpostgresql` 같은 Unix-domain socket 경로는 local 접속인데 현재 remote(true)로 분류됩니다. 실측 direct core import도 true였습니다. 보안 우회는 아니고 로컬 socket 기반 백필 실행 시 확인 env가 필요해지는 운영 마찰입니다.","recommendation":"로컬 dev UX까지 보존하려면 absolute socket path 및 abstract namespace host를 별도 local 후보로 인정할지 정책 결정 후 테스트를 추가하십시오. 보수적 게이트 정책이면 문서화만으로도 충분합니다.","defer":false,"deferRationale":null,"fixNow":false},{"severity":"P3","location":"verification","description":"능동 검증 결과: r3 PoC `DATABASE_URL=...localhost...?host=prod.invalid node scripts/backfill-stored-asset-metadata.mjs --apply`는 exit 1로 abort했습니다. `npx tsc --noEmit`은 exit 0, `npm run lint`는 exit 0이며 기존 LiveKit warning 1개만 있었습니다. `git diff develop..HEAD --check`도 clean입니다. Focused vitest는 이 restricted/read-only 세션에서 Vite/esbuild config 로딩 중 `spawn EPERM`으로 시작하지 못했습니다.","recommendation":"P2 수정 후 일반 개발 셸에서 focused vitest 또는 전체 vitest를 재실행하십시오.","defer":false,"deferRationale":null,"fixNow":false}]}