{
  "reviewer": "evaluator",
  "schemaVersion": 1,
  "scores": {
    "completeness": 9.7,
    "consistency": 9.8,
    "specificity": 9.8,
    "actionability": 9.6
  },
  "weightedTotal": 9.72,
  "verdict": "WARNING",
  "issues": [
    {
      "severity": "P3",
      "location": "src/app/api/assets/[id]/route.ts:38",
      "description": "동일 누출 클래스가 범위 밖에 잔존: GET /api/assets/[id]가 prisma.generatedAsset.findUnique를 include만 쓰고 NextResponse.json(asset)로 raw 전체 행(filePath/thumbnailPath/prompt/workflowId/status 등 내부 필드 전부)을 반환한다. 본인/superAdmin 게이트(route.ts:33-36)가 있어 활성 익스플로잇은 아니나 WI-014가 정형화하려는 응답 allowlist 원칙과 불일치. WI-014는 POST/PATCH에 한정해 스코프를 명시했으므로 회귀 아님.",
      "recommendation": "후속 WI에서 GET /api/assets/[id]도 select allowlist로 공개 표시 필드만 반환하도록 정형화. (소비처 grep으로 클라가 실제 쓰는 필드 확정 후 select 구성)",
      "defer": true,
      "deferRationale": "WI-014 명시 스코프(POST/PATCH 4라우트) 밖이며 owner/superAdmin 게이트로 외부 노출 없음. 동일 클래스 정형화 후속으로 분리 적절.",
      "fixNow": false
    },
    {
      "severity": "P3",
      "location": "src/app/api/spaces/route.ts:133-153",
      "description": "POST /api/spaces의 prisma.space.create가 select가 아닌 include로 전체 Space 행(inviteCode/accessSecret/ownerId/mapData 포함)을 메모리에 로드한 뒤 응답은 수동 객체 {id,name,template}로만 직렬화한다. 응답으로는 새지 않으므로(테스트 route.test.ts:366 exact-key 가드) 누출 결함은 없으나 app.md 서버 불변식 #2('select/include 명시 — 필요한 필드만 선택')와 정합도가 낮다. PATCH 라우트들은 select allowlist로 통일했는데 POST의 create만 include 패턴이라 내부 일관성 미세 격차.",
      "recommendation": "create에 select allowlist를 두어 행 자체를 필요 필드만 로드하도록 통일(또는 의도적 include 유지 시 사유 주석). 비차단 개선.",
      "defer": true,
      "deferRationale": "응답에는 inviteCode 등이 새지 않음(수동 직렬화 + 테스트 exact-key 가드로 잠금). 정보위생·코드일관성 개선이지 보안/회귀 아님.",
      "fixNow": false
    },
    {
      "severity": "P3",
      "location": "전 코드베이스(invite-link 흐름)",
      "description": "POST /api/spaces에서 inviteCode 제거 후, 어떤 API도 owner에게 inviteCode를 반환하지 않는다(GET 목록/상세/PATCH 모두 미반환, join/[inviteCode]는 코드 소비측이지 발급측 아님). 또한 inviteCode를 owner에게 표시/복사하는 UI가 존재하지 않음(grep으로 확인). 즉 invite-link 발급 흐름은 이미 미완성/dead였고(WI-009가 inviteCode를 '죽은 필드'로 처리한 것과 정합), WI-014의 제거가 활성 흐름을 깨지 않는다. 다만 향후 invite-link 기능을 살릴 경우 발급 경로가 필요함을 명시.",
      "recommendation": "invite-link 기능을 제품에 도입하려면 별도 owner 전용 발급/조회 경로(예: 대시보드 settings의 owner-scoped GET)를 신설. 현재는 dead라 무영향.",
      "defer": true,
      "deferRationale": "현 제품에 invite-link 발급/표시 UI가 없어 활성 회귀 없음. 신규 기능 도입 시점의 별도 작업이며 WI-014 결함 아님.",
      "fixNow": false
    }
  ]
}
