{"reviewer":"codex","schemaVersion":1,"scores":null,"weightedTotal":null,"verdict":"WARNING","issues":[{"severity":"P2","location":"src/features/space/editor/internal/use-editor.ts:11, src/features/space/editor/internal/editor-system.ts:9","description":"editor 모듈이 여전히 game 모듈의 하위 경로인 `@/features/space/game/events`를 직접 import한다. `internal/*` 위반은 아니지만, 제시된 아키텍처 규칙인 외부 모듈은 `module/index.ts` 배럴만 import한다는 조건에는 맞지 않는다. `game/index.ts`는 `eventBridge`와 `GameEvents`만 일부 export하고, editor가 쓰는 editor payload 타입들은 아직 export하지 않는다.","recommendation":"`game/index.ts`에서 `EditorTilePaintedPayload`, `EditorObjectSelectedPayload`, `EditorToolChangePayload`, `EditorTileSelectPayload`, `EditorLayerSelectPayload`, `EditorLayerVisibilityPayload`, `EditorTilePaintRequestPayload` 등을 public type으로 export하고 editor 쪽 import를 `@/features/space/game`로 통일하라. `game/events`가 의도된 public submodule이면 WI/ESLint 예외로 명시하라.","defer":false,"deferRationale":null,"fixNow":true},{"severity":"P3","location":"eslint.config.mjs:18","description":"`no-restricted-imports` 패턴은 alias 경로 `@/**/internal/**`만 막는다. 실제로 stdin synthetic lint 확인에서 `../../game/internal/tilemap/map-data` 같은 상대경로 cross-module internal import는 no-restricted-imports 오류 없이 통과했다. 현재 `src` 내 잔존 상대경로 위반은 0건이지만, 규칙 자체는 같은 종류의 향후 위반을 놓칠 수 있다.","recommendation":"상대경로 cross-module internal 접근까지 막아야 한다면 path-resolving boundary 규칙(`eslint-plugin-boundaries`, `import/no-internal-modules` 등)이나 별도 검증 스크립트를 추가하라. alias-only 정책이라면 해당 제약을 AGENTS/WI에 명시하고 CI grep으로 보강하라.","defer":false,"deferRationale":null,"fixNow":true}]}