{
  "reviewer": "evaluator",
  "schemaVersion": 1,
  "scores": {
    "completeness": 9.8,
    "consistency": 9.7,
    "specificity": 9.7,
    "actionability": 9.6
  },
  "weightedTotal": 9.71,
  "verdict": "PASS",
  "issues": [
    {
      "severity": "P3",
      "location": "src/features/space/livekit-moderation/internal/eviction.ts:9-10 + src/app/api/livekit/token/route.ts:14-15",
      "description": "dev 폴백 리터럴 DEV_API_KEY=\"devkey\"/DEV_API_SECRET=\"devsecret\"가 eviction.ts와 token/route.ts 두 곳에 중복 정의됐다. 이번 WI는 moderate 라우트의 사본을 eviction.ts로 통합(중복 1건 해소)했으나 token 라우트의 동일 폴백 정책 사본은 여전히 별도 존재. dev 전용·동일값이라 즉시 위험은 없으나 폴백 정책이 두 SoT로 분기하면 향후 드리프트 가능(예: 한 쪽만 폴백 비활성화).",
      "recommendation": "dev 폴백 자격을 단일 SoT(예: livekit-moderation 또는 livekit 모듈 배럴의 resolveLiveKitConfig)로 수렴하고 token 라우트도 동일 헬퍼 소비. 선택적 후속 WI 후보(이번 변경의 회귀 아님 — token 사본은 선재).",
      "defer": true,
      "deferRationale": "선재 중복(token 라우트는 이번 WI 변경 대상 아님), dev 전용·동일 리터럴이라 보안/동작 영향 0. 폴백 통합은 별도 리팩토링 범위.",
      "fixNow": false
    },
    {
      "severity": "P3",
      "location": "src/app/api/spaces/[id]/admin/members/route.ts:168-178",
      "description": "kick은 `target.userId`가 있을 때만 enforce + removeSpaceParticipant를 수행한다. 게스트 멤버(userId=null, guestSessionId 기반)는 LiveKit identity가 `guest-{guestSessionId}`인데 이 경로로는 removeSpaceParticipant가 호출되지 않아 게스트의 화상 타일은 잔존 가능. ban/mute 동일. 다만 dashboard admin members 액션의 1차 타깃은 등록 사용자이며, 확정 모델/설계 consult가 등록 사용자 범위로 한정했고 게스트 enforce는 별도 식별자 경계라 본 WI 범위 밖으로 명시됐다. r2의 token route BANNED 가드도 등록 사용자(session.user.id) 경로만 차단하며, 게스트는 별 sessionToken 경로라 일관되게 범위 밖.",
      "recommendation": "게스트 추방까지 화상 제거가 필요하면 후속 WI에서 guestSessionId→`guest-{id}` identity로 removeSpaceParticipant 확장(eviction.ts에 identity kind 파라미터화). 현 WI 수용 기준은 등록 사용자 kick/ban/unban이므로 회귀 아님.",
      "defer": true,
      "deferRationale": "확정 모델이 등록 사용자(userId) 범위로 한정. 게스트 화상 제거는 별도 식별자 경계의 신규 표면이라 본 WI 수용 기준 외. 기존 게스트 moderate(음성)도 별 경로.",
      "fixNow": false
    },
    {
      "severity": "P3",
      "location": "src/features/space/livekit-moderation/internal/eviction.ts:54-75 / src/app/api/spaces/[id]/admin/members/route.ts:177,229",
      "description": "removeSpaceParticipant는 best-effort라 EvictionResult{removed,reason}를 반환하지만 호출측(kick/ban)이 결과를 응답에 전혀 반영하지 않는다(realtimeEnforced만 enforce 기준). 운영자는 화상 제거가 실제로 됐는지(removed) / 미설정(not_configured) / 실패(remove_failed)를 응답으로 구분할 수 없다. 설계상 화상 제거는 보강 동작이라 admin 액션 성공/실패를 좌우하지 않는 것이 의도이나, 관측성 측면에서 reason을 응답 메타에 노출하면 운영 진단이 쉬워진다.",
      "recommendation": "선택: 응답에 livekitEvicted/evictionReason 같은 비차단 메타 추가(계약 확장이라 소비처 영향 검토 필요). 현재는 console.warn 서버 로그로 추적 가능하므로 즉시 필요는 아님.",
      "defer": true,
      "deferRationale": "best-effort 보강 동작의 의도된 한계. 서버 로그(console.warn)로 진단 가능하고 응답 계약 확장은 별도 결정. 기능 정확성에 영향 없음.",
      "fixNow": false
    }
  ]
}
