{
  "reviewer": "evaluator",
  "schemaVersion": 1,
  "scores": {
    "completeness": 9.8,
    "consistency": 9.8,
    "specificity": 9.9,
    "actionability": 9.6
  },
  "weightedTotal": 9.78,
  "verdict": "WARNING",
  "issues": [
    {
      "severity": "P3",
      "location": "src/features/space/livekit/internal/LiveKitMediaContext.tsx:578",
      "description": "lint --max-warnings 0 실행 시 1 warning 발생('Unused eslint-disable directive, react-hooks/refs'). 독립 검증: develop 베이스를 직접 체크아웃해 동일 파일 lint 실행 → 동일 warning 1건 재현(DEVELOP_LINT_EXIT=1). WI-015 변경분(`git diff develop...HEAD --name-only`)에 LiveKit 파일 없음 → WI-015이 도입한 결함 아닌 선재 부채. errors 0. 이전 WI 원장도 '기존 LiveKit 경고 1'로 기록. WI-015은 lint-neutral(tsc0/vitest165·165/build0).",
      "recommendation": "LiveKitMediaContext.tsx L577의 불필요한 `/* eslint-disable react-hooks/refs */` 지시자를 제거하는 별도 chore WI로 처리. Phaser 생명주기(WI-015) 도메인과 무관하므로 본 WI 범위 밖.",
      "defer": true,
      "deferRationale": "develop 베이스에 이미 존재하는 선재 lint 부채로 WI-015이 도입/악화시키지 않음(diff에 LiveKit 미포함). LiveKit 미디어 도메인 사안이라 Phaser 생명주기 수정과 경계가 다름. errors 0이고 빌드/타입/테스트 게이트 전부 green. 별도 정리 WI로 분리하는 것이 경계상 타당.",
      "fixNow": false
    },
    {
      "severity": "P3",
      "location": "src/features/space/game/internal/objects/interactive-object.ts:82,86,130",
      "description": "SUSPECTED(심층방어 공백, 결함 아님): destroy()는 glowTween을 ref(`this.glowTween?.destroy()`)로, indicator 떠다니는 tween을 `killTweensOf(this.indicator)`로 정리한다. glowTween의 실제 target은 `this.graphics`이고 destroy()에서 graphics 대상 killTweensOf는 호출하지 않는다. startGlow가 glowTween ref를 보관하므로 정상 경로에선 누수 없으나, 만약 향후 graphics 대상 추가 tween(ref 미보관)이 생기면 indicator처럼 누수 가능. 현 코드 기준 graphics 대상 tween은 startGlow 단일·ref 보관이라 실누수 없음 — 회귀 아님.",
      "recommendation": "장기적으로 indicator와 동일하게 `killTweensOf(this.graphics)`를 destroy에 추가하면 ref 의존을 줄여 일관된 방어가 된다(선택). 현재는 불필요.",
      "defer": true,
      "deferRationale": "현 구현에서 graphics 대상 tween은 startGlow 1곳뿐이고 glowTween ref로 destroy()에서 확정 정리되므로 실제 누수 경로 없음. 순수 심층방어 개선 제안이며 동작 회귀 없음.",
      "fixNow": false
    }
  ]
}
