{
  "reviewer": "evaluator",
  "schemaVersion": 1,
  "scores": {
    "completeness": 9.5,
    "consistency": 9.7,
    "specificity": 9.8,
    "actionability": 9.5
  },
  "weightedTotal": 9.62,
  "verdict": "WARNING",
  "issues": [
    {
      "severity": "P3",
      "location": "server/handlers/enforce.ts:142 (handleInternalHttp)",
      "description": "공개 포트에 노출된 /internal/enforce 엔드포인트에 rate-limit이 없음. docker-compose.prod.yml:11이 SOCKET_PORT를 공개 매핑하므로 socket.io와 동일 포트로 외부에서 도달 가능. 다만 서명 검증(verifyEnforceSignature)이 DB 접근(verifyPostcondition)보다 먼저 수행되어(L189 < L208) 무효 서명 요청은 DB에 닿기 전 401/403으로 차단됨 → DB 증폭 DoS 표면 없음. 비용은 저렴한 HMAC 연산 + body read뿐. 실악용 미입증.",
      "recommendation": "OCI 인스턴스에서 /internal/enforce를 사설망/방화벽으로 제한하거나, 핸들러에 IP/시간당 단순 카운터 기반 rate-limit 추가(부채). 현 구조에서 증폭 위험 낮아 비차단.",
      "defer": true,
      "deferRationale": "서명 선검증으로 DB 증폭 없음. 잔여 비용은 HMAC 연산뿐이라 실질 DoS 표면 미미. 인프라 레벨 방화벽이 일차 방어. WI-012 인프라 하드닝 후속으로 적합.",
      "fixNow": false
    },
    {
      "severity": "P3",
      "location": "src/features/space/enforce/internal/contract.ts:34,68 (ENFORCE_REPLAY_WINDOW_MS / isFreshTimestamp)",
      "description": "replay 방지는 ±30s window만 사용(nonce/사용내역 기록 없음). window 내(30s)에 가로챈 유효 enforce 요청을 그대로 재전송 가능. 단 Redis 없는 단일 인스턴스 설계상 nonce 저장소 부재가 의도적이며, ban/kick/mute/unmute/role은 멱등(postcondition이 DB 현재상태와 일치해야 통과 → 이미 적용된 상태 재적용은 no-op 또는 동일 결과). 권한 상승/임의 추방으로 확대 불가. 실악용 미입증.",
      "recommendation": "현 멱등성으로 충분. 강화 필요 시 timestamp+sig 해시를 30s TTL in-memory Set에 기록해 단일 사용 강제(메모리 무한증가 없음). 비차단.",
      "defer": true,
      "deferRationale": "모든 enforce 액션이 멱등이고 postcondition이 DB 상태 일치를 요구하므로 window 내 재사용도 부작용 없음(이미 ban된 유저 재-ban 등). nonce 도입은 Redis-less 설계와 트레이드오프, 효익 미미.",
      "fixNow": false
    },
    {
      "severity": "P3",
      "location": "server/handlers/enforce.ts:80 (applyEnforcement) / 전체 enforce 소켓 경로",
      "description": "enforce 서버측 소켓 적용 경로(detach 전체 room 이탈, grace flush, 다중탭 player:left 1회, role 캐시 강등)에 대한 자동화 통합 테스트가 없음. 계약(contract.ts) 단위 테스트 17케이스는 충실하나, applyEnforcement/detachSocketFromSpace/removeUserPresence의 멀티탭·grace·room-leave 동작은 코드 정합성으로만 검증됨(io mock 부재). tsc 0/lint 0/vitest 88·88로 회귀는 막히나 행위 회귀 테스트는 미비.",
      "recommendation": "socket.io mock 또는 in-memory 통합 하니스로 ban→detach→재전송 차단/다중탭 player:left 1회를 회귀 고정. WI-011-test(api 라우트 하니스)와 묶어 후속.",
      "defer": true,
      "deferRationale": "프로젝트에 소켓 통합 테스트 하니스가 아직 부재(현 vitest는 순수 유틸 한정). 코드 경로는 독립 정밀 검토로 정합성 확인 완료(detach 동기·grace 후 disconnect·spaceId 클리어로 지연 disconnect의 leaveSpace 재실행 차단·player:left 사용자단위 1회). WI-011-test 범위.",
      "fixNow": false
    }
  ]
}
