{"reviewer":"codex","schemaVersion":1,"scores":null,"weightedTotal":null,"verdict":"WARNING","issues":[{"severity":"P3","location":"validation","description":"Targeted validation could not be completed in this sandbox. `npm test -- src/lib/pagination.test.ts` failed during Vitest startup with `Error: spawn EPERM` while loading `vitest.config.ts`, before executing tests.","recommendation":"Run `npm test -- src/lib/pagination.test.ts` in an environment that permits Vitest/esbuild child-process startup.","defer":true,"deferRationale":"Environment/sandbox restriction prevented test execution; code inspection found no functional defect in the reviewed diff.","fixNow":false}]}